{
  "schema_version": "misa.signal_candidate_rollup.v1",
  "mode": "signal-candidate-daily-rollup",
  "ok": true,
  "source": {
    "intake_contract_mode": "signal-intake-contract",
    "adaptive_gate_mode": "adaptive-candidate-gate",
    "simulation_mode": "dry-run"
  },
  "summary": {
    "adapted_signal_count": 3,
    "queue_item_count": 3,
    "daily_rollup_window_hours": 24,
    "validation_ready_count": 1,
    "held_count": 1,
    "rejected_count": 1,
    "production_authority": false
  },
  "signal_adapters": [
    {
      "source_contract_id": "session_distiller_success",
      "channel": "chat",
      "intake_mode": "summary_first",
      "input_surface": "distilled_summary",
      "raw_lookup": "conditional_source_ref_fragments",
      "full_raw_default": false,
      "scan_interval_minutes": 30,
      "durable_learning_rollup": "daily",
      "immediate_exception_queue": false,
      "mapped_signal_count": 1
    },
    {
      "source_contract_id": "session_distiller_failure",
      "channel": "runtime",
      "intake_mode": "failure_log_signal",
      "input_surface": "distiller_failure_summary",
      "raw_lookup": "failure_log_context_only",
      "full_raw_default": false,
      "scan_interval_minutes": 30,
      "durable_learning_rollup": "daily",
      "immediate_exception_queue": true,
      "mapped_signal_count": 1
    },
    {
      "source_contract_id": "farcaster_behavior",
      "channel": "farcaster",
      "intake_mode": "pre_reply_defense_then_feedback",
      "input_surface": "action_audit_and_post_feedback",
      "raw_lookup": "public_thread_hash_or_url_only",
      "full_raw_default": false,
      "scan_interval_minutes": 30,
      "durable_learning_rollup": "daily",
      "immediate_exception_queue": true,
      "mapped_signal_count": 1
    }
  ],
  "adapted_signals": [
    {
      "signal_id": "signal-chat-summary",
      "source_event_id": "chat-summary",
      "source_cycle_id": "cycle-chat-summary",
      "source_contract_id": "session_distiller_success",
      "channel": "chat",
      "adapter": {
        "default_input": "distilled_summary",
        "raw_lookup": "conditional_source_ref_fragments",
        "full_raw_default": false
      },
      "cadence": {
        "scan_interval_minutes": 30,
        "durable_learning_rollup": "daily",
        "immediate_exception_queue": false
      },
      "normalized_signals": ["stable_user_preference", "route:memory"],
      "route_target": "memory",
      "evidence": {
        "evidence_count": 2,
        "risk_level": "low",
        "redaction_status": "clean",
        "positive_value": true
      },
      "safety": {
        "production_authority": false,
        "publication_allowed": false,
        "live_effects": {
          "writes_persistent_memory": false,
          "publishes_skill": false,
          "starts_timer": false,
          "changes_session_mechanics": false,
          "posts_publicly": false
        }
      }
    },
    {
      "signal_id": "signal-runtime-failure",
      "source_event_id": "runtime-failure",
      "source_cycle_id": "cycle-runtime-failure",
      "source_contract_id": "session_distiller_failure",
      "channel": "runtime",
      "adapter": {
        "default_input": "distiller_failure_summary",
        "raw_lookup": "failure_log_context_only",
        "full_raw_default": false
      },
      "cadence": {
        "scan_interval_minutes": 30,
        "durable_learning_rollup": "daily",
        "immediate_exception_queue": true
      },
      "normalized_signals": ["single_failure", "route:damping"],
      "route_target": "damping",
      "evidence": {
        "evidence_count": 1,
        "risk_level": "medium",
        "redaction_status": "clean",
        "positive_value": true
      },
      "safety": {
        "production_authority": false,
        "publication_allowed": false,
        "live_effects": {
          "writes_persistent_memory": false,
          "publishes_skill": false,
          "starts_timer": false,
          "changes_session_mechanics": false,
          "posts_publicly": false
        }
      }
    },
    {
      "signal_id": "signal-farcaster-feedback",
      "source_event_id": "farcaster-feedback",
      "source_cycle_id": "cycle-farcaster-feedback",
      "source_contract_id": "farcaster_behavior",
      "channel": "farcaster",
      "adapter": {
        "default_input": "action_audit_and_post_feedback",
        "raw_lookup": "public_thread_hash_or_url_only",
        "full_raw_default": false
      },
      "cadence": {
        "scan_interval_minutes": 30,
        "durable_learning_rollup": "daily",
        "immediate_exception_queue": true
      },
      "normalized_signals": ["farcaster_public_memory_risk", "route:policy"],
      "route_target": "policy",
      "evidence": {
        "evidence_count": 2,
        "risk_level": "high",
        "redaction_status": "clean",
        "positive_value": true
      },
      "safety": {
        "production_authority": false,
        "publication_allowed": false,
        "live_effects": {
          "writes_persistent_memory": false,
          "publishes_skill": false,
          "starts_timer": false,
          "changes_session_mechanics": false,
          "posts_publicly": false
        }
      }
    }
  ],
  "candidate_queue": {
    "queue_policy": {
      "source": "v0.10 local closed loop",
      "enqueue_all_adapted_signals": true,
      "durable_learning_rollup": "daily",
      "production_authority": false,
      "approval_required_for_production": true
    },
    "items": [
      {
        "queue_id": "queue-chat-summary",
        "candidate_id": "adaptive-chat-summary",
        "source_signal_id": "signal-chat-summary",
        "route_target": "memory",
        "decision": "validation_ready",
        "queue_state": "ready_for_daily_rollup",
        "priority": "medium",
        "scheduled_rollup": "daily",
        "verification_required": true,
        "verification_commands": ["npm run rollup:misa"],
        "approval_required_for_production": true,
        "suppression_applied": false,
        "production_authority": false
      },
      {
        "queue_id": "queue-runtime-failure",
        "candidate_id": "adaptive-runtime-failure",
        "source_signal_id": "signal-runtime-failure",
        "route_target": "damping",
        "decision": "held_for_more_evidence",
        "queue_state": "watch_for_more_evidence",
        "priority": "low",
        "scheduled_rollup": "daily",
        "verification_required": false,
        "verification_commands": [],
        "approval_required_for_production": true,
        "suppression_applied": false,
        "production_authority": false
      },
      {
        "queue_id": "queue-farcaster-feedback",
        "candidate_id": "adaptive-farcaster-feedback",
        "source_signal_id": "signal-farcaster-feedback",
        "route_target": "policy",
        "decision": "rejected",
        "queue_state": "rejected_suppression",
        "priority": "low",
        "scheduled_rollup": "daily",
        "verification_required": false,
        "verification_commands": [],
        "approval_required_for_production": true,
        "suppression_applied": true,
        "production_authority": false
      }
    ]
  },
  "daily_rollup": {
    "rollup_id": "qianxuesen-daily-local-rollup",
    "window_hours": 24,
    "cadence_source": "misa.signal_intake_contract.v1",
    "candidate_counts": {
      "ready_for_daily_rollup": 1,
      "watch_for_more_evidence": 1,
      "rejected_suppression": 1
    },
    "route_counts": {
      "memory": 1,
      "skill": 0,
      "case": 0,
      "policy": 1,
      "damping": 1,
      "ignore": 0
    },
    "source_contract_counts": {
      "memory": 1,
      "skill": 0,
      "case": 0,
      "policy": 1,
      "damping": 1,
      "ignore": 0
    },
    "included_candidate_ids": ["adaptive-chat-summary"],
    "held_candidate_ids": ["adaptive-runtime-failure"],
    "rejected_candidate_ids": ["adaptive-farcaster-feedback"],
    "next_actions": [
      "Keep validation-ready candidates in local validation only.",
      "Hold thin candidates until the next signal scan or daily rollup.",
      "Keep rejected candidates as suppression evidence, not publication evidence."
    ],
    "durable_outputs": {
      "memory_candidates": 1,
      "skill_candidates": 0,
      "case_candidates": 0,
      "policy_candidates": 1,
      "publication_allowed": false,
      "writes_persistent_memory": false
    }
  },
  "safety": {
    "production_authority": false,
    "publication_allowed": false,
    "live_effects": {
      "writes_persistent_memory": false,
      "publishes_skill": false,
      "starts_timer": false,
      "changes_session_mechanics": false,
      "posts_publicly": false
    },
    "blocked_operations": [
      "persistent_memory_write",
      "zilliz_replacement",
      "farcaster_publish",
      "skill_publication",
      "production_skill_installation",
      "session_mechanic_replacement",
      "timer_or_service_start",
      "provider_route_change"
    ]
  },
  "checks": [
    {
      "id": "daily_rollup_is_24_hours",
      "ok": true,
      "reason": "Durable learning stays on the daily rollup cadence."
    }
  ],
  "warnings": [],
  "violations": []
}
